[
  {
    "blast_radius_version": "1.0.0",
    "changed_fan_in_max": 1,
    "changed_fan_in_total": 1,
    "changed_fan_out_total": 0,
    "components_touched": [
      "infra:ci",
      "infra:docker",
      "infra:docs",
      "infra:repo-root",
      "infra:scripts",
      "tools:hogli"
    ],
    "crosses_component_boundary": true,
    "crosses_ownership_boundary": false,
    "crosses_product_boundary": false,
    "distinct_components": 6,
    "distinct_owners": 1,
    "distinct_platforms": 1,
    "distinct_products": 0,
    "downstream_component_count": 1,
    "downstream_components": [
      "tools:hogli"
    ],
    "downstream_file_count": 1,
    "downstream_product_count": 0,
    "files_without_owner": 5,
    "graph_coverage_share": 0.125,
    "graph_covered_files": 2,
    "hub_files_touched": 0,
    "owners_touched": [
      "team-devex"
    ],
    "pr_id": "github.com/PostHog/posthog#pr/45696",
    "pr_number": 45696,
    "products_touched": [],
    "reach_depth_limit": 1,
    "reachability_band": "component",
    "reachability_is_uncertain": true,
    "reachability_uncertainty": [
      "no import parser for ['go']; graph reach understated",
      "only 2/16 changed files are graph nodes",
      "5 changed file(s) have no owner rule"
    ],
    "risk_surface_count": 1,
    "touches_platform_surface": true,
    "touches_shared_library": false
  },
  {
    "blast_radius_version": "1.0.0",
    "changed_fan_in_max": null,
    "changed_fan_in_total": null,
    "changed_fan_out_total": null,
    "components_touched": [
      "infra:ci"
    ],
    "crosses_component_boundary": false,
    "crosses_ownership_boundary": false,
    "crosses_product_boundary": false,
    "distinct_components": 1,
    "distinct_owners": 1,
    "distinct_platforms": 1,
    "distinct_products": 0,
    "downstream_component_count": 0,
    "downstream_components": [],
    "downstream_file_count": 0,
    "downstream_product_count": 0,
    "files_without_owner": 0,
    "graph_coverage_share": 0.0,
    "graph_covered_files": 0,
    "hub_files_touched": 0,
    "owners_touched": [
      "team-devex"
    ],
    "pr_id": "github.com/PostHog/posthog#pr/46473",
    "pr_number": 46473,
    "products_touched": [],
    "reach_depth_limit": 1,
    "reachability_band": "local",
    "reachability_is_uncertain": true,
    "reachability_uncertainty": [
      "only 0/11 changed files are graph nodes"
    ],
    "risk_surface_count": 1,
    "touches_platform_surface": true,
    "touches_shared_library": false
  },
  {
    "blast_radius_version": "1.0.0",
    "changed_fan_in_max": null,
    "changed_fan_in_total": null,
    "changed_fan_out_total": null,
    "components_touched": [
      "common:storybook",
      "infra:repo-root",
      "packages:quill"
    ],
    "crosses_component_boundary": true,
    "crosses_ownership_boundary": true,
    "crosses_product_boundary": false,
    "distinct_components": 3,
    "distinct_owners": 2,
    "distinct_platforms": 2,
    "distinct_products": 0,
    "downstream_component_count": 0,
    "downstream_components": [],
    "downstream_file_count": 0,
    "downstream_product_count": 0,
    "files_without_owner": 3,
    "graph_coverage_share": 0.0,
    "graph_covered_files": 0,
    "hub_files_touched": 0,
    "owners_touched": [
      "@sampennington",
      "platform-ux"
    ],
    "pr_id": "github.com/PostHog/posthog#pr/46726",
    "pr_number": 46726,
    "products_touched": [],
    "reach_depth_limit": 1,
    "reachability_band": "component",
    "reachability_is_uncertain": true,
    "reachability_uncertainty": [
      "only 0/4 changed files are graph nodes",
      "3 changed file(s) have no owner rule"
    ],
    "risk_surface_count": 1,
    "touches_platform_surface": false,
    "touches_shared_library": true
  },
  {
    "blast_radius_version": "1.0.0",
    "changed_fan_in_max": null,
    "changed_fan_in_total": null,
    "changed_fan_out_total": null,
    "components_touched": [
      "common:esbuilder",
      "common:replay-headless",
      "infra:repo-root",
      "services:mcp"
    ],
    "crosses_component_boundary": true,
    "crosses_ownership_boundary": false,
    "crosses_product_boundary": false,
    "distinct_components": 4,
    "distinct_owners": 0,
    "distinct_platforms": 2,
    "distinct_products": 0,
    "downstream_component_count": 1,
    "downstream_components": [
      "services:mcp"
    ],
    "downstream_file_count": 1,
    "downstream_product_count": 0,
    "files_without_owner": 4,
    "graph_coverage_share": 0.0,
    "graph_covered_files": 0,
    "hub_files_touched": 0,
    "owners_touched": [],
    "pr_id": "github.com/PostHog/posthog#pr/46785",
    "pr_number": 46785,
    "products_touched": [],
    "reach_depth_limit": 1,
    "reachability_band": "component",
    "reachability_is_uncertain": true,
    "reachability_uncertainty": [
      "only 0/4 changed files are graph nodes",
      "4 changed file(s) have no owner rule"
    ],
    "risk_surface_count": 1,
    "touches_platform_surface": false,
    "touches_shared_library": true
  },
  {
    "blast_radius_version": "1.0.0",
    "changed_fan_in_max": 1,
    "changed_fan_in_total": 1,
    "changed_fan_out_total": 1,
    "components_touched": [
      "infra:docs"
    ],
    "crosses_component_boundary": false,
    "crosses_ownership_boundary": false,
    "crosses_product_boundary": false,
    "distinct_components": 1,
    "distinct_owners": 0,
    "distinct_platforms": 1,
    "distinct_products": 0,
    "downstream_component_count": 1,
    "downstream_components": [
      "infra:docs"
    ],
    "downstream_file_count": 1,
    "downstream_product_count": 0,
    "files_without_owner": 1,
    "graph_coverage_share": 1.0,
    "graph_covered_files": 1,
    "hub_files_touched": 0,
    "owners_touched": [],
    "pr_id": "github.com/PostHog/posthog#pr/47825",
    "pr_number": 47825,
    "products_touched": [],
    "reach_depth_limit": 1,
    "reachability_band": "component",
    "reachability_is_uncertain": true,
    "reachability_uncertainty": [
      "1 changed file(s) have no owner rule"
    ],
    "risk_surface_count": 0,
    "touches_platform_surface": false,
    "touches_shared_library": false
  },
  {
    "blast_radius_version": "1.0.0",
    "changed_fan_in_max": 624,
    "changed_fan_in_total": 869,
    "changed_fan_out_total": 184,
    "components_touched": [
      "platform:hogql",
      "platform:monolith"
    ],
    "crosses_component_boundary": true,
    "crosses_ownership_boundary": true,
    "crosses_product_boundary": false,
    "distinct_components": 2,
    "distinct_owners": 2,
    "distinct_platforms": 1,
    "distinct_products": 0,
    "downstream_component_count": 57,
    "downstream_components": [
      "common:hogql_parser",
      "common:hogvm",
      "platform:api",
      "platform:clickhouse",
      "platform:dagster",
      "platform:enterprise",
      "platform:hogql",
      "platform:models",
      "platform:monolith",
      "platform:session-recordings",
      "platform:tasks",
      "platform:temporal",
      "product:actions",
      "product:ai_observability",
      "product:alerts",
      "product:analytics_platform",
      "product:batch_exports",
      "product:business_knowledge",
      "product:cohorts",
      "product:conversations",
      "product:customer_analytics",
      "product:dashboards",
      "product:data_catalog",
      "product:data_modeling",
      "product:data_quality",
      "product:data_warehouse",
      "product:early_access_features",
      "product:endpoints",
      "product:engineering_analytics",
      "product:error_tracking",
      "product:experiments",
      "product:exports",
      "product:feature_flags",
      "product:growth",
      "product:live_debugger",
      "product:logs",
      "product:marketing_analytics",
      "product:mcp_analytics",
      "product:metrics",
      "product:notebooks",
      "product:notifications",
      "product:posthog_ai",
      "product:product_analytics",
      "product:pulse",
      "product:replay",
      "product:replay_vision",
      "product:revenue_analytics",
      "product:signals",
      "product:skills",
      "product:slack_app"
    ],
    "downstream_file_count": 795,
    "downstream_product_count": 45,
    "files_without_owner": 1,
    "graph_coverage_share": 1.0,
    "graph_covered_files": 13,
    "hub_files_touched": 2,
    "owners_touched": [
      "team-data-tools",
      "team-platform-features"
    ],
    "pr_id": "github.com/PostHog/posthog#pr/49264",
    "pr_number": 49264,
    "products_touched": [],
    "reach_depth_limit": 1,
    "reachability_band": "platform_wide",
    "reachability_is_uncertain": true,
    "reachability_uncertainty": [
      "8 changed file(s) use dynamic imports; edges incomplete",
      "1 changed file(s) have no owner rule"
    ],
    "risk_surface_count": 2,
    "touches_platform_surface": false,
    "touches_shared_library": false
  },
  {
    "blast_radius_version": "1.0.0",
    "changed_fan_in_max": 3060,
    "changed_fan_in_total": 4512,
    "changed_fan_out_total": 302,
    "components_touched": [
      "frontend:app",
      "frontend:scenes",
      "frontend:shared-lib",
      "platform:api",
      "platform:models",
      "product:workflows",
      "services:mcp"
    ],
    "crosses_component_boundary": true,
    "crosses_ownership_boundary": false,
    "crosses_product_boundary": false,
    "distinct_components": 7,
    "distinct_owners": 0,
    "distinct_platforms": 2,
    "distinct_products": 1,
    "downstream_component_count": 95,
    "downstream_components": [
      "common:storybook",
      "frontend:app",
      "frontend:layout",
      "frontend:queries",
      "frontend:scenes",
      "frontend:shared-lib",
      "frontend:toolbar",
      "infra:e2e",
      "platform:api",
      "platform:clickhouse",
      "platform:enterprise",
      "platform:hogql",
      "platform:management",
      "platform:migrations",
      "platform:models",
      "platform:monolith",